iteration	commit	score	delta	status	description
1	20260315130528	60	+25	keep	expand tools: 0 → 6
2	20260315130529	65	+5	keep	align persona: ⚙️ Pragmatic Applica... → ⚙️ Pragmatic Applica...
3	20260315130529	65	+0	discard	add hard rules section
4	20260315130529	65	+0	discard	refine workflow steps
5	20260315130529	82	+17	keep	expand triggers: 0 → 5
6	20260315130529	82	+0	discard	
7	20260315130529	82	+0	discard	
8	20260315130529	82	+0	discard	add hard rules section
9	20260315130529	82	+0	discard	refine workflow steps
10	20260315130529	82	+0	discard	
11	20260315130529	82	+0	discard	
12	20260315130529	82	+0	discard	
13	20260315130529	82	+0	discard	add hard rules section
14	20260315130529	82	+0	discard	refine workflow steps
15	20260315130529	82	+0	discard	
1	20260315131034	82	+0	discard	expand tools: 6 → 6
2	20260315131035	82	+0	discard	
3	20260315131035	82	+0	discard	add hard rules section
4	20260315131035	82	+0	discard	refine workflow steps
5	20260315131035	82	+0	discard	expand triggers: 5 → 5
6	20260315131035	82	+0	discard	expand tools: 6 → 6
7	20260315131035	82	+0	discard	
8	20260315131035	82	+0	discard	add hard rules section
9	20260315131035	82	+0	discard	refine workflow steps
10	20260315131035	82	+0	discard	expand triggers: 5 → 5
11	20260315131035	82	+0	discard	expand tools: 6 → 6
12	20260315131035	82	+0	discard	
13	20260315131035	82	+0	discard	add hard rules section
14	20260315131035	82	+0	discard	refine workflow steps
15	20260315131035	82	+0	discard	expand triggers: 5 → 5
16	20260315131035	82	+0	discard	expand tools: 6 → 6
17	20260315131035	82	+0	discard	
18	20260315131035	82	+0	discard	add hard rules section
19	20260315131035	82	+0	discard	refine workflow steps
20	20260315131035	82	+0	discard	expand triggers: 5 → 5
